{
  "schemaVersion": 1,
  "nodes": {
    "setup": { "x": 0, "y": 0 },
    "research": { "x": 480, "y": 0 },
    "architect": { "x": 960, "y": 0 },
    "plan": { "x": 1440, "y": 0 },
    "backlog": { "x": 1920, "y": 0 },
    "tracker": { "x": 2400, "y": 0 },
    "implement": { "x": 2880, "y": 0 },
    "workflow-diagram": { "x": 480, "y": 440 },
    "help": { "x": 960, "y": 440 },
    "skills-release": { "x": 1440, "y": 440 }
  },
  "edges": {
    "setup-research": {
      "start": [240, 80],
      "segments": [[320, 80, 400, 80, 480, 80]]
    },
    "research-architect": {
      "start": [720, 80],
      "segments": [[800, 80, 880, 80, 960, 80]]
    },
    "architect-plan": {
      "start": [1200, 80],
      "segments": [[1280, 80, 1360, 80, 1440, 80]]
    },
    "plan-backlog": {
      "start": [1680, 80],
      "segments": [[1760, 80, 1840, 80, 1920, 80]]
    },
    "backlog-tracker": {
      "start": [2160, 80],
      "segments": [[2240, 80, 2320, 80, 2400, 80]]
    },
    "implement-tracker": {
      "start": [2880, 80],
      "segments": [[2800, 80, 2720, 80, 2640, 80]]
    },
    "implement-backlog": {
      "start": [3000, 0],
      "segments": [
        [3000, -50, 2970, -80, 2900, -80],
        [2120, -80, 2040, -50, 2040, 0]
      ]
    },
    "plan-tracker": {
      "start": [1560, 160],
      "segments": [
        [1560, 210, 1600, 240, 2000, 240],
        [2440, 240, 2480, 210, 2480, 160]
      ]
    },
    "architect-tracker": {
      "start": [1080, 160],
      "segments": [
        [1080, 250, 1120, 280, 1800, 280],
        [2520, 280, 2560, 250, 2560, 160]
      ]
    },
    "setup-tracker": {
      "start": [120, 0],
      "segments": [
        [120, -90, 150, -120, 1200, -120],
        [2490, -120, 2520, -90, 2520, 0]
      ]
    }
  },
  "regions": [
    { "lane": "configuration", "x": -24, "y": -52, "width": 288, "height": 236 },
    { "lane": "planning", "x": 456, "y": -52, "width": 1728, "height": 236 },
    { "lane": "coordination", "x": 2376, "y": -52, "width": 288, "height": 236 },
    { "lane": "implementation", "x": 2856, "y": -52, "width": 288, "height": 236 },
    { "lane": "documentation", "x": 456, "y": 388, "width": 768, "height": 236 },
    { "lane": "independent", "x": 1416, "y": 388, "width": 288, "height": 236 }
  ]
}
